{
 "subject": {
  "slug": "jane-murphy",
  "name": "Jane Murphy",
  "org": "Example Group",
  "role_verified": "Chief Operations Officer",
  "sample_date": "2026-09-19"
 },
 "layer1": {
  "headline": "Jane Murphy's public record is accurate where her employer controls it and five years out of date everywhere else, so the first screen introduces a role she left in 2021 before it introduces the one she holds.",
  "key_figures": [
   {
    "label": "Title variants live",
    "value": "3",
    "note": "one superseded, one abbreviated"
   },
   {
    "label": "Sources reviewed",
    "value": "31",
    "note": "retrieved during this run"
   },
   {
    "label": "Adverse items",
    "value": "0",
    "note": "in the sources searched"
   },
   {
    "label": "Wrong-person results",
    "value": "1",
    "note": "in the first five"
   }
  ],
  "searcher_finds": [
   "The employer leadership page ranks first for both queries and is accurate and current.",
   "The second result is an aggregator profile carrying a title she left in 2021, and the fifth is a different Jane Murphy entirely.",
   "Independent, editorial material exists but sits below the aggregated and sponsored results a casual searcher stops at."
  ],
  "scorecard": [
   {
    "dimension": "Credibility",
    "verdict": "Adequate",
    "evidence": "Facts corroborate across the employer page, two annual reports and the standards register, with one unverified programme claim."
   },
   {
    "dimension": "Adverse material",
    "verdict": "Clean",
    "evidence": "Nothing critical or disputed in the sources searched, which did not include paywalled archives, court filings or broadcast."
   },
   {
    "dimension": "Distinctiveness",
    "verdict": "Moderate",
    "evidence": "A consistent operational-resilience theme runs through her appearances, but most published material restates her job description."
   },
   {
    "dimension": "Discoverability",
    "verdict": "Diluted",
    "evidence": "A namesake and an outdated aggregator profile both occupy the first screen for the bare-name query."
   },
   {
    "dimension": "Consistency",
    "verdict": "Mixed",
    "evidence": "Three live title forms and one restructured business unit named in the employer biography."
   },
   {
    "dimension": "Momentum",
    "verdict": "Steady",
    "evidence": "Four dated public items across 2024 and 2025, roughly one every six months."
   }
  ],
  "fixes": [
   {
    "title": "Correct the aggregator entry",
    "effort": "Low",
    "what": "Submit the current title and employer through the directory's correction form, then re-sample the first screen four weeks later.",
    "why": "It is the second result for her name and it is wrong, which costs more than any amount of new content would add."
   },
   {
    "title": "Refresh the employer biography",
    "effort": "Low",
    "what": "Remove the restructured unit name, state the standards-body appointment, and date the page so republication carries a timestamp.",
    "why": "The employer page is what every aggregator copies, so one correction propagates."
   },
   {
    "title": "Publish one owned piece a quarter",
    "effort": "Medium",
    "what": "Short bylined comment on operational resilience, published on the newsroom and syndicated once.",
    "why": "It is the only lever that moves Distinctiveness without relying on other people's coverage."
   }
  ]
 },
 "first_impression": [
  {
   "query": "Jane Murphy",
   "rank": 1,
   "title": "Jane Murphy — Example Group leadership",
   "url": "https://www.example.com/leadership/jane-murphy",
   "class": "company-owned"
  },
  {
   "query": "Jane Murphy",
   "rank": 2,
   "title": "Jane Murphy, Director of Supply Chain — directory profile",
   "url": "https://directory.example.org/people/jane-murphy",
   "class": "aggregator"
  },
  {
   "query": "Jane Murphy",
   "rank": 3,
   "title": "Operations chief on resilience — trade quarterly",
   "url": "https://trade.example.net/features/operations-2025",
   "class": "editorial"
  },
  {
   "query": "Jane Murphy",
   "rank": 4,
   "title": "Jane Murphy — public records and contact details",
   "url": "https://broker.example.info/p/jane-murphy",
   "class": "data-broker"
  },
  {
   "query": "Jane Murphy",
   "rank": 5,
   "title": "Jane Murphy, ceramic artist — studio site",
   "url": "https://studio.example.art/about",
   "class": "wrong-person"
  },
  {
   "query": "Jane Murphy Example Group",
   "rank": 1,
   "title": "Jane Murphy — Example Group leadership",
   "url": "https://www.example.com/leadership/jane-murphy",
   "class": "company-owned"
  },
  {
   "query": "Jane Murphy Example Group",
   "rank": 2,
   "title": "Example Group names new COO — wire summary",
   "url": "https://wire.example.net/2021/appointments",
   "class": "editorial"
  },
  {
   "query": "Jane Murphy Example Group",
   "rank": 3,
   "title": "Example Group executive team — company profile",
   "url": "https://www.example.com/about/board",
   "class": "company-owned"
  },
  {
   "query": "Jane Murphy Example Group",
   "rank": 4,
   "title": "Jane Murphy — auto-generated biography",
   "url": "https://bios.example.info/jane-murphy",
   "class": "auto-generated"
  },
  {
   "query": "Jane Murphy Example Group",
   "rank": 5,
   "title": "Example Group — sponsored listing",
   "url": "https://ads.example.net/example-group",
   "class": "sponsored"
  }
 ],
 "sections": {
  "career": [
   {
    "tag": "FACT",
    "finding": "Named Chief Operations Officer of Example Group in March 2021, a promotion from Director of Supply Chain, a role she had held since 2017 according to the company's own leadership page and two subsequent annual reports.",
    "url": "https://www.example.com/leadership/jane-murphy",
    "accessed": "2026-09-19",
    "date": "Mar 2021"
   },
   {
    "tag": "FACT",
    "finding": "Holds a degree in industrial engineering and a management qualification, both listed consistently on the employer page and on two independent conference biographies reviewed for this assessment.",
    "url": "https://www.example.com/about/board",
    "accessed": "2026-09-19"
   },
   {
    "tag": "FLAG",
    "finding": "An aggregator profile still presents the 2017 supply-chain title as current, and it ranks on the first screen for the bare-name query, so an ordinary searcher meets a role she left five years ago before meeting the one she holds.",
    "url": "https://directory.example.org/people/jane-murphy",
    "accessed": "2026-09-19",
    "marks": [
     "SINGLE-SOURCE"
    ]
   },
   {
    "tag": "FACT",
    "finding": "Appointed a non-executive director of an industry standards body in 2023; the appointment is recorded on the body's own register and repeated in trade coverage.",
    "url": "https://standards.example.org/register/2023",
    "accessed": "2026-09-19",
    "date": "2023"
   },
   {
    "tag": "FLAG",
    "finding": "No independent record of the 2019 operational programme credited to her on the employer page could be located in trade press or regulatory filings during this run.",
    "url": "https://www.example.com/news/2019-programme",
    "accessed": "2026-09-19",
    "marks": [
     "NOT VERIFIED"
    ]
   }
  ],
  "public_profile": [
   {
    "tag": "FACT",
    "finding": "Panel member, Example Supply Chain Forum, on the resilience of multi-site manufacturing networks; the session page carries a recorded video and a full speaker list.",
    "url": "https://forum.example.org/2025/panel-resilience",
    "accessed": "2026-09-19",
    "date": "May 2025",
    "title_used": "Chief Operations Officer, Example Group"
   },
   {
    "tag": "FACT",
    "finding": "Interviewed for a trade podcast on automation in food manufacturing, a 34-minute episode with a written summary and a transcript published alongside it.",
    "url": "https://podcast.example.net/episodes/142",
    "accessed": "2026-09-19",
    "date": "Nov 2025",
    "title_used": "COO, Example Group"
   },
   {
    "tag": "FLAG",
    "finding": "A university alumni page announces her as a 2024 guest lecturer under the superseded supply-chain title, which is the same defect the aggregator carries and suggests the source of both is an old press biography.",
    "url": "https://alumni.example.edu/events/2024-guest-lecture",
    "accessed": "2026-09-19",
    "date": "2024",
    "title_used": "Director of Supply Chain"
   },
   {
    "tag": "FACT",
    "finding": "Keynote at a regional manufacturing awards evening, reported by one local outlet with a photograph and a two-paragraph write-up.",
    "url": "https://localnews.example.co/awards-2025",
    "accessed": "2026-09-19",
    "date": "Oct 2025"
   }
  ],
  "topics": {
   "quotes": [
    {
     "text": "Resilience is not a project you finish; it is a cost you choose to keep paying after the crisis is over.",
     "said_where": "Example Supply Chain Forum panel",
     "date": "May 2025",
     "url": "https://forum.example.org/2025/panel-resilience"
    },
    {
     "text": "Automation moved our constraint from the line to the people who plan it.",
     "said_where": "Trade podcast, episode 142",
     "date": "Nov 2025",
     "url": "https://podcast.example.net/episodes/142"
    }
   ],
   "themes": [
    {
     "theme": "Operational resilience after disruption",
     "weight": 5,
     "evidence_count": 6
    },
    {
     "theme": "Automation and the planning constraint",
     "weight": 3,
     "evidence_count": 3
    },
    {
     "theme": "Multi-site manufacturing networks",
     "weight": 2,
     "evidence_count": 2
    }
   ]
  },
  "media": {
   "coverage": [
    {
     "tag": "FACT",
     "finding": "Trade quarterly profile of the group's operations programme, quoting her twice and carrying an independently commissioned photograph.",
     "url": "https://trade.example.net/features/operations-2025",
     "accessed": "2026-09-19",
     "date": "Jun 2025"
    },
    {
     "tag": "FACT",